{
  "$schema": "./schema.json",
  "catalog_id": "NCS-BASELINE",
  "version": "1.0.0-draft.2",
  "baseline_date": "2026-09-04",
  "status": "project-defined implementation draft",
  "languages": [
    "en",
    "zh-CN"
  ],
  "normative_rules": {
    "t0_gate": "Every applicable T0 control must be independently VERIFIED. Failed, unknown, inconclusive, untested, or stale T0 evidence produces NO-GO. An approved emergency deviation may authorize time-bounded continuity, but it never converts the control to PASS or VERIFIED and never establishes baseline conformity.",
    "t0_gate_zh_CN": "每个适用 T0 控制都必须被独立验证为 VERIFIED；失败、未知、无法判定、未测试或证据过期均产生 NO-GO。经批准的紧急偏离可以限时维持服务，但绝不能把控制转换为 PASS/VERIFIED，也不建立基线符合性。",
    "framework_mappings": "Informative only; no certification or exact equivalence is claimed.",
    "framework_mappings_zh_CN": "外部框架映射仅供参考，不构成认证或精确等价声明。"
  },
  "control_lifecycle": [
    "PROPOSED",
    "READY",
    "IMPLEMENTED",
    "CANDIDATE_DONE",
    "VERIFIED"
  ],
  "verification_results": [
    "PASS",
    "FAIL",
    "INCONCLUSIVE",
    "NOT_TESTED"
  ],
  "tiers": {
    "T0": {
      "name_en": "Guardrails",
      "name_zh_CN": "硬门槛",
      "frequency": "continuous monitoring where feasible; independent verification at least quarterly and after material change",
      "frequency_zh_CN": "可行时持续监控；至少每季度及重大变更后独立复验"
    },
    "T1": {
      "name_en": "Foundation",
      "name_zh_CN": "基础级",
      "frequency": "at least quarterly and after material change",
      "frequency_zh_CN": "至少每季度及重大变更后复验"
    },
    "T2": {
      "name_en": "Production",
      "name_zh_CN": "生产级",
      "frequency": "at least semi-annually and after material change",
      "frequency_zh_CN": "至少每半年及重大变更后复验"
    },
    "T3": {
      "name_en": "Assured",
      "name_zh_CN": "可信级",
      "frequency": "control-owner review at least semi-annually, independent verification at least annually, and review after material change",
      "frequency_zh_CN": "至少每半年由 Control Owner 复核、至少每年独立验证，并在重大变更后复验"
    },
    "T4": {
      "name_en": "Adaptive",
      "name_zh_CN": "自适应级",
      "frequency": "continuous metrics plus quarterly adversarial and failure-mode review",
      "frequency_zh_CN": "持续度量，并至少每季度进行对抗与失败模式复核"
    }
  },
  "service_profiles": [
    "GPU-IaaS",
    "Bare-Metal-GPU",
    "Managed-Kubernetes",
    "Managed-Slurm-HPC",
    "Model-Training",
    "Model-Serving",
    "Agent-Platform",
    "Sovereign-Regulated"
  ],
  "evidence_profiles": {
    "EP-GOV": {
      "minimum_evidence_en": [
        "approved service-scoped decision and accountable owner",
        "current obligation, risk, exception, and assurance records",
        "independent review result with scope and expiry"
      ],
      "minimum_evidence_zh_CN": [
        "经批准且范围明确的决策与可追责 Owner",
        "当前义务、风险、例外和保证记录",
        "包含范围与有效期的独立复核结果"
      ]
    },
    "EP-INVENTORY": {
      "minimum_evidence_en": [
        "authoritative API or system export",
        "owner, tenant, service, lifecycle, and dependency linkage",
        "desired-versus-actual reconciliation result"
      ],
      "minimum_evidence_zh_CN": [
        "权威 API 或系统导出",
        "Owner、租户、服务、生命周期和依赖关联",
        "期望状态与实际状态对账结果"
      ]
    },
    "EP-IDENTITY-POLICY": {
      "minimum_evidence_en": [
        "identity, role, policy, and credential configuration export",
        "correlated authorization and audit events",
        "denial, expiry, revocation, or break-glass test"
      ],
      "minimum_evidence_zh_CN": [
        "身份、角色、策略与凭据配置导出",
        "关联授权判定与审计事件",
        "拒绝、过期、撤销或 Break-glass 测试"
      ]
    },
    "EP-ISOLATION-RUNTIME": {
      "minimum_evidence_en": [
        "versioned topology, configuration, allocation, and tenant-scope records",
        "positive and prohibited-path test results",
        "cleanup, quarantine, rollback, restore, or rebuild trace as applicable"
      ],
      "minimum_evidence_zh_CN": [
        "版本化拓扑、配置、分配与租户范围记录",
        "正向及禁止路径测试结果",
        "适用的清理、隔离、回滚、恢复或重建轨迹"
      ]
    },
    "EP-DATA-SUPPLY": {
      "minimum_evidence_en": [
        "ownership, classification, source, lineage, and lifecycle record",
        "access, key, build, provenance, signature, scan, admission, or deletion evidence",
        "authorized negative test and rollback, recall, or recovery result"
      ],
      "minimum_evidence_zh_CN": [
        "Owner、分类、来源、血缘与生命周期记录",
        "访问、密钥、构建、来源证明、签名、扫描、准入或删除证据",
        "经授权负向测试及回滚、召回或恢复结果"
      ]
    },
    "EP-TELEMETRY-EXPOSURE": {
      "minimum_evidence_en": [
        "asset-linked finding or protected event sample",
        "coverage, freshness, time-integrity, and retention result",
        "detection replay, remediation retest, or tamper test"
      ],
      "minimum_evidence_zh_CN": [
        "与资产关联的 Finding 或受保护事件样本",
        "覆盖率、新鲜度、时间完整性与保留结果",
        "检测重放、修复复测或篡改测试"
      ]
    },
    "EP-AGENT": {
      "minimum_evidence_en": [
        "agent identity, delegator, immutable goal/scope, model/prompt/skill/tool versions",
        "typed tool, policy, approval, budget, stop, and trace records",
        "prompt-injection, confused-deputy, scope, stop, and independent-verifier tests"
      ],
      "minimum_evidence_zh_CN": [
        "Agent 身份、委托方、不可变 Goal/Scope 以及 Model/Prompt/Skill/Tool 版本",
        "Typed Tool、策略、审批、预算、停止与 Trace 记录",
        "Prompt Injection、Confused Deputy、Scope、Stop 与独立 Verifier 测试"
      ]
    },
    "EP-OPERATIONS-RECOVERY": {
      "minimum_evidence_en": [
        "case, command, decision, notification, or responsibility record",
        "containment, revocation, capacity, restore, rebuild, or reopening trace",
        "exercise result and independently verified closure"
      ],
      "minimum_evidence_zh_CN": [
        "Case、指挥、决策、通知或责任记录",
        "隔离、撤销、容量、恢复、重建或开服轨迹",
        "演练结果与独立验证关闭"
      ]
    },
    "EP-PHYSICAL": {
      "minimum_evidence_en": [
        "facility, device, firmware, BMC/OOB, access, and custody inventory",
        "configuration, access-event, maintenance, and patch evidence",
        "sanitization, reassignment, destruction, or unauthorized-path test"
      ],
      "minimum_evidence_zh_CN": [
        "机房、设备、固件、BMC/OOB、访问与保管清单",
        "配置、访问事件、维护与补丁证据",
        "清除、重分配、销毁或未授权路径测试"
      ]
    }
  },
  "verification_profiles": {
    "VP-GOV": {
      "steps_en": [
        "confirm scope and accountable decision authority",
        "sample current records and expired exceptions",
        "verify independent challenge and customer-impact treatment"
      ],
      "steps_zh_CN": [
        "确认范围与可追责决策权限",
        "抽样当前记录及过期例外",
        "验证独立挑战与客户影响处理"
      ]
    },
    "VP-INVENTORY": {
      "steps_en": [
        "compare independent discovery with authoritative inventory",
        "inject or select an unknown/stale item",
        "verify owner, tenant, and dependency reconciliation"
      ],
      "steps_zh_CN": [
        "比较独立发现与权威清单",
        "注入或选择未知/过期对象",
        "验证 Owner、租户与依赖对账"
      ]
    },
    "VP-IDENTITY-POLICY": {
      "steps_en": [
        "reproduce an allowed decision",
        "execute a prohibited or expired path",
        "verify revocation and protected audit at every enforcement point"
      ],
      "steps_zh_CN": [
        "复现允许判定",
        "执行禁止或过期路径",
        "验证所有执行点的撤销与受保护审计"
      ]
    },
    "VP-ISOLATION": {
      "steps_en": [
        "confirm deployed versions and declared boundary",
        "exercise cross-tenant or management negative paths on the real data path",
        "verify cleanup, mismatch detection, quarantine, and safe recovery"
      ],
      "steps_zh_CN": [
        "确认部署版本与声明边界",
        "在真实数据路径执行跨租户或管理面负向测试",
        "验证清理、偏差发现、隔离与安全恢复"
      ]
    },
    "VP-DATA-SUPPLY": {
      "steps_en": [
        "trace a representative object from source to use and disposal",
        "attempt unauthorized, unsigned, malicious, revoked, or expired handling",
        "verify recall, rollback, deletion, or recovery"
      ],
      "steps_zh_CN": [
        "跟踪代表性对象从来源到使用与处置",
        "尝试未授权、未签名、恶意、已吊销或过期处理",
        "验证召回、回滚、删除或恢复"
      ]
    },
    "VP-TELEMETRY": {
      "steps_en": [
        "reconcile required sources and event fields",
        "simulate source loss, relevant behavior, or tamper",
        "verify alert, evidence integrity, and remediation retest"
      ],
      "steps_zh_CN": [
        "对账必需数据源与事件字段",
        "模拟数据源丢失、相关行为或篡改",
        "验证告警、证据完整性与修复复测"
      ]
    },
    "VP-AGENT": {
      "steps_en": [
        "freeze identity, delegation, goal, scope, tools, budget, and verifier",
        "test untrusted-content, approval, scope, cost, repetition, and destructive-action boundaries",
        "confirm deterministic stop, complete trace, and independent verdict"
      ],
      "steps_zh_CN": [
        "冻结身份、委托、Goal、Scope、Tool、Budget 与 Verifier",
        "测试不可信内容、审批、范围、成本、重复和破坏性动作边界",
        "确认确定性停止、完整 Trace 与独立结论"
      ]
    },
    "VP-RECOVERY": {
      "steps_en": [
        "exercise command and reliable scoping",
        "perform containment, revocation, restore or known-good rebuild",
        "independently verify identity, integrity, isolation, objectives, and reopening"
      ],
      "steps_zh_CN": [
        "演练指挥与可靠定界",
        "执行隔离、撤销、恢复或已知可信重建",
        "独立验证身份、完整性、隔离、目标与重新开服"
      ]
    },
    "VP-PHYSICAL": {
      "steps_en": [
        "inspect facility/device/OOB scope and access paths",
        "test an unauthorized path or representative lifecycle event",
        "verify firmware state, sanitation, custody, and reassignment decision"
      ],
      "steps_zh_CN": [
        "检查机房/设备/OOB 范围与访问路径",
        "测试未授权路径或代表性生命周期事件",
        "验证固件状态、清除、保管链与重分配决策"
      ]
    }
  },
  "metric_ids": [
    "NCSM-GOV-01",
    "NCSM-GOV-06",
    "NCSM-ASM-01",
    "NCSM-ASM-03",
    "NCSM-IAM-01",
    "NCSM-IAM-04",
    "NCSM-API-01",
    "NCSM-API-04",
    "NCSM-ISO-01",
    "NCSM-ISO-02",
    "NCSM-ISO-04",
    "NCSM-ISO-05",
    "NCSM-ORC-01",
    "NCSM-ORC-03",
    "NCSM-DAT-01",